发布者ID,发布时间,发布来源,发布内容,收藏数,转发数,评论数,点赞数,verified_reason,description
瑷珲历史陈列馆,05月25日09:30,来自360安全浏览器, 我参与了@新华社发起的投票【一起云悼念袁隆平，再送袁老一程！】，我投给了“一日三餐，米香弥漫，饱食者当常忆袁公”这个选项，你也快来表态吧~,0,0,0,0,瑷珲历史陈列馆官方微博,瑷珲历史陈列馆是全国唯一一座以全面反映中俄东部关系史为主要陈列内容的专题性遗址博物馆，现为首批全国爱国主义教育示范基地、首批国家一级博物馆、首批国家国防教育示范基地、第五届全国十大陈列展览精品馆、国家AAAA旅游景区、全国红色旅游经典景区。
燕赵都市报,05月24日16:36,来自微博视频号, 【#夫人泪别袁隆平#】5月24日上午，袁隆平告别仪式现场：遗体上国旗覆盖，安卧鲜花翠柏，夫人神形悲戚，泪别袁老。再回看袁老90岁生日时，将第一口蛋糕喂给老伴，令人心碎。L华商网的微博视频​,0,2,0,17,燕赵都市报官方微博,河北省内最具影响力的融媒体平台之一，百姓视角、关注民生。燕都融媒体嚢括了燕赵都市报、官方微博、官方微信、头条号、人民号、百家号、一点号等。
平安鸡西,05月24日08:36,来自360安全浏览器, 【痛悼！#共和国痛失袁隆平院士#】,0,0,0,0,黑龙江省鸡西市公安局官方微博,弘扬公安机关正能量 服务社会群众
石时关注,05月25日20:14,来自微博视频号, 【袁爷爷我们永远怀念您！民众自发有序悼念袁隆平】2021年5月24日上午，长沙明阳殡仪馆外，全国各地数万民众排起长队前来送别袁隆平院士。送别人群在留言中留下心里话：“我们会好好吃饭的！也会好好学习的！”“吾辈自强，先生千古，永远怀念”。送别袁老，一路走好！L石时关注的微博视频​,0,0,0,3,石家庄广播电视台新媒体石时关注官方微博,石家庄广播电视台官方微博
四川新闻网德阳频道,05月22日16:46,来自OPPOFindX, #袁老一路走好#【#新华微评#：禾下乘凉梦，不悔是初心】5月22日，“杂交水稻之父”袁隆平在湖南长沙逝世，享年91岁。一代科学巨擘陨落，令人扼腕。一直以来，袁隆平心中有两个梦想：“禾下乘凉梦”和“杂交水稻覆盖全球梦”。袁隆平播下的种子，如今已是一派丰收的景象。他留下的极其厚重丰富的科学遗产和精神财富，必将激励一代又一代中国人开拓进取、勇攀高峰。袁老千古！科学永恒！vⅰa：新华社2德阳2德阳  ,0,0,0,1,四川新闻网德阳频道(www.dy.newssc.org)官方微博,
北京晚报,05月24日12:47,来自微博weibo.com, 【#64个账号侮辱袁隆平被永久封号#】据@微博管理员，5月22日，袁隆平院士逝世，社会各界沉痛哀悼。微博发现有个别账号借此机会发布侮辱攻击袁老的有害内容，造成恶劣的影响。站方在之前处理的基础上，根据网友投诉，对发布此类信息的64个账号依据有关法律法规，做出永久关闭处罚。相关账号名单↓​,0,9,42,119,北京晚报官方微博,关注百姓的关注，关注中国的关注，关注世界的关注 新闻热线 85202188 85202199 13911656789
甘肃发布,05月26日17:53,来自微博weibo.com, 【#要追就追这样的星#】袁隆平、吴孟超2位院士离世，但“袁隆平星”“吴孟超星”仍将一直守望我们。不少小行星以中国科学家名字命名，这是国际性、永久性荣誉。共和国群星闪耀，每一次仰望星空，都能感受到他们守护的力量、激励的力量。#吴孟超遗体告别仪式举行# #钟南山为吴孟超送来花圈挽联#​​​​（来源：@新华社）  ,0,7,0,11,甘肃省政府新闻办官方微博,我们为您提供甘肃政务民生资讯，我们带您领略甘肃独特魅力。交响丝路如意甘肃欢迎您！
无锡博报,05月22日12:32,来自微博weibo.com, #秘书称袁隆平目前在医院#希望袁爷爷“健康快乐超百岁”！​,0,0,1,9,无锡广播电视台新闻中心官方微博,为您报道行进中的声音无锡、影像无锡。这里是无锡广播电视台官方新闻微博。欢迎围观、共话无锡。
新都服务,05月23日18:33,来自微博视频号, 【#长沙外卖小哥说外卖单全是鲜花#】#新都服务.生活资讯#23日，湖南杂交水稻研究中心前，一些无法亲自前来缅怀袁隆平院士的市民，通过鲜花外卖遥寄哀思。外卖小哥称，今天一早开始“好多订单都是送到袁老师这里的，外卖单全是鲜花单”。满满的鲜花丛前，外卖小哥脱帽鞠躬。#长沙的鲜花外卖单#L红网的微博视频​​​2成都  ,0,0,0,2,成都市新都区行政审批局,新都服务政务微博服务群众办事大厅，关注民生、服务社会、提升效率、促进发展！能为市民群众提供办事咨询、问题投诉、建议意见和信息资讯等政务服务。“新都服务”竭诚为您服务！
中国宣汉,05月23日15:49,来自iPhone客户端, 【#袁老说没实现的梦想后继有人会实现#】袁隆平团队研究员说，“袁老生前基本每天都去田里，风雨无阻。他看到我们，第一句话就聊杂交水稻，哪怕在吃饭也迫不及待了解田的进展。”生前，袁老曾说：“希望在有生之年，能实现禾下乘凉梦。我没有实现，我的后继人会实现。”网友：请您放心，后辈努力！#送别国之脊梁袁隆平#L央视新闻的微博视频2达州·宣汉县  ,0,1,1,1,四川省达州市宣汉县人民政府官方微博,泱泱中华，百城千县；浩浩雄风，壮哉宣汉。千山巍巍，峙鸾凤而走蛟龙；三河溶溶，沐日月而浸乾坤。雄关要隘，当川陕之孔道；山程水陆，接渝鄂之要津。美丽宣汉欢迎您！
中国网议库,05月24日13:36,来自微博视频号, 【#袁隆平梦想后继有人#】巨星陨落，国人泪目。我们失去了您，我们更要成为您。两年前，#新青年#第77期邀请袁隆平团队成员吴俊讲述了他随袁老奋斗的点点滴滴。今天，让我们再次重温。L新青年工作室的微博视频​,0,0,0,0,中国网政协频道和中国网议库官方微博,中国政协频道（地址：cppcc.china.com.cn）是中国网重要频道，政在协商（微信：cppcc_china），主要报道政协组织、党派团体的政治协商、参政议政、民主监督、社会服务工作；分析多元声音，增进各界共识、关注并助推协商民主广泛多层制度化发展；依托丰沛的政协委员资源和高端的互联网媒体平台，桥接体制内外资源，助力社会实践探索。
陇南司法,05月25日06:40,来自微博视频号, 【沙画还原袁隆平的梦想】“我有着一个梦，走在田埂上，它同我一般高，我拉着我最亲爱的朋友，坐在稻穗下乘凉……”这是袁老的梦。请放心，您的禾下乘凉梦，我们会接棒努力！致敬！送别！（视频：@方浪浪）L央视新闻的微博视频​,0,8,6,19,甘肃省陇南市司法局官方微博,传播陇南司法声音，讲好陇南司法故事。
文史博览,05月22日13:59,来自OPPO随光而变R17, #袁隆平逝世#袁老，一路走好！​,0,2,0,1,《文史博览》杂志社官方微博,《文史博览》是由湖南省政协主管主办的原创类文史月刊。1960年创刊，以“亲历、亲见、亲闻”为特色，强调真实性、思想性、可读性。全国公开发行，发行量在政协同类期刊中遥遥领先。
成都东安,05月24日21:18,来自微博视频号, #袁老身上覆盖着鲜红的国旗#【#袁老在生命最后还在关心超级稻#】24日上午10时，“杂交水稻之父”、“共和国勋章”获得者#袁隆平遗体送别仪式#在长沙明阳山殡仪馆举行。社会各界人士前来吊唁，送别袁隆平院士最后一程，“他这一辈子走得很平凡，但他真的是一个很伟大的人。”L央视频的微博视频​​​  ,0,0,0,1,成都市龙泉驿区人民政府东安街道办事处官方微博,成都市龙泉驿区人民政府东安街道办事处
民生周刊,05月24日11:32,来自微博视频号, 【南京为您而亮！#南京地标亮灯缅怀袁隆平#】5月23日晚，南京新街口、鼓楼、湖南路、夫子庙等地大屏上都播出了缅怀袁隆平院士的视频。袁隆平院士曾就读于南京师范大学附属中学，2002年，他曾回到母校参加百年校庆。袁隆平院士遗体送别仪式今天举行，#送别袁老#，一路走好！L直播南京官方版的微博视频​​​,0,1,0,4,人民日报社《民生周刊》杂志法人微博,
四川省社会科学院,05月22日21:22,来自微博视频号, #社科分享#【泪目怀念！#视频回顾袁隆平的90后追梦人生#】“我有两个梦，一个是禾下乘凉梦；第二个是杂交稻覆盖全球梦”…为了这两个梦，袁隆平毕生投身杂交水稻事业。天下田因你丰足，上亿人永无饥馑。此后每一缕升起的炊烟里，都有我们最深沉的追忆↓↓#您放心我们会好好吃饭#L人民日报的微博视频​​​  ,0,0,0,2,四川省社会科学院官方微博,坚强理论阵地 高端新型智库 一流学术殿堂 重要传播平台
北京晚报,05月24日16:44,, #赵立坚说袁隆平的梦想一定会实现#【外交部：#袁隆平逝世是中国和世界的巨大损失#，他将永远为人们所铭记】5月24日，外交部发言人赵立坚主持例行记者会。连日来，联合国官方微博、粮农组织总干事、世界粮食奖基金会主席等发文缅怀袁隆平院士，海外媒体和网友也以多种方式表达追思，感谢他为推进粮食安全、消除贫困、造福民众作出的杰出贡献。请问中方对此有何评论？赵立坚表示，中国著名科学家、共和国勋章获得者、中国工程院院士袁隆平逝世后，中外各界都表示沉痛悼念，这充分说明，他对中国乃至世界杂交水稻事业所作的贡献，受到广泛认可和高度评价。他的逝世是中国和世界的巨大损失，他将永远为人们所缅怀和铭记。赵立坚说，目前中国杂交水稻年种植面积已达2.4亿亩，仅每年增产的粮食就可以养活8000万人。中国用不到世界9%的耕地，养活了世界近1/5的人口，将饭碗牢牢地端在自己手中，这与袁隆平院士的艰苦努力密不可分。在自身粮食增产增收的同时，我们也始终秉持开放和负责任的态度，向世界各国慷慨分享杂交水稻技术。赵立坚介绍，中国杂交水稻技术的输出与对外开放几乎同步。1979年，中方首次对外提供了杂交水稻种子。40年后，中国杂交水稻已在亚洲、非洲、美洲的数十个国家和地区推广种植，年种植面积达800万公顷。40年间，袁隆平院士和他的研究人员还先后赴印度、巴基斯坦、越南、缅甸、孟加拉国、斯里兰卡、马达加斯加、美国等国为水稻研究人员提供建议和咨询，并通过国际培训班为80多个发展中国家，培训超过1.4万名杂交水稻专业技术人才。上述努力为解决世界饥饿和贫困问题作出了巨大贡献。“金黄沉甸甸的稻谷，让无数人享受到了吃饱的幸福，看到了生活的希望。”赵立坚说，袁隆平院士不仅属于中国，也属于世界。他毕生奋斗的梦想，就是让杂交水稻覆盖全球，让所有人不挨饿。中国创造了粮食自给的人间奇迹，也有意愿、有能力继续为全球粮食安全治理作出更大贡献。我们相信在各方的携手努力下，袁隆平院士的梦想一定会成为现实，饥饿和贫困终将从地球上消失。（@北京晚报记者刘柳）#科技部沉痛悼念袁隆平# #袁隆平家属以书面形式致答谢辞#  ,0,125,70,1216,北京晚报官方微博,关注百姓的关注，关注中国的关注，关注世界的关注 新闻热线 85202188 85202199 13911656789
民法典通解通读,05月25日18:54,来自微博视频号, #袁隆平逝世#侮辱攻击，毒舌有罪！L民法典通解通读的微博视频​,0,0,0,0,北京广播电视台科教频道《民法典通解通读》栏目官方微博,播出时间：每周一至周五21：15-21：45，周六、周日21：30-22：00 （微博 抖音 北京时间app也都有同步直播喔）
中国网直播,05月24日16:24,来自微博视频号, 【最后的道别！#夫人泪别袁隆平#】5月24日上午，袁隆平告别仪式现场：遗体上国旗覆盖，安卧鲜花翠柏，夫人神形悲戚，泪别袁老。L中国网直播的微博视频​,0,28,14,346,中国互联网新闻中心中国网直播官方微博,中国网官方直播频道，中国最大的政务直播平台。投稿合作VX:zbzhushou
江苏发展大会,05月22日18:58,来自微博weibo.com," 【追忆！#袁隆平让江苏盐碱地飘出稻香#】5月22日，""杂交水稻之父""、中国工程院院士、""共和国勋章""获得者袁隆平逝世。多年来，他与江苏结下了深厚渊源。2012年开始，海水稻的研究成为袁隆平工作的重点。2020年，江苏如东海水稻""超优千号""创下盐碱地水稻高产新纪录，得知消息后，袁隆平为江苏水稻点赞。#袁隆平高中曾在南京就读#O忆“杂交水稻之父”袁隆平：曾在南京读高中让江苏盐碱地飘出稻香  ",0,0,1,5,江苏发展大会官方微博,江苏发展大会官方微博
青春上海,05月23日13:40,来自微博国际版, 【#18岁男子侮辱袁隆平被行拘5日#：连发多条侮辱言论】日照公安5月23日在其微信公众号上通报，2021年5月22日，“杂交水稻之父”、中国工程院院士、“共和国勋章”获得者袁隆平逝世。新浪微博某博主连续发布三条涉及袁隆平院士的侮辱性言论，该言论于当日13时54分发布，14时2分被博主自行删除，引发部分网民留言跟评，造成恶劣社会影响。经调查核实，该网民系贾某，男，18岁，河南安阳人，现为日照某民办职业学校短期培训班学员。目前，该贾因违反《中华人民共和国治安管理处罚法》，被公安机关处以行政拘留五日处罚。  ,0,3,3,12,中国共产主义青年团上海市委员会官方微博,中国共产主义青年团上海市委员会官方微博。我是青春上海，我海派、时尚、睿智、温暖，充满魅力与个性；我喜欢挑战、大胆创新、热心公益、勇于担当，…
定陶检察,05月24日21:22,来自微博视频号, 【又一例！#网民泰迪朋友圈侮辱袁隆平被刑拘#】5月24日，重庆。24日上午，袁隆平遗体送别仪式在长沙明阳山殡仪馆铭德厅举行。同日重庆警方发布通报称，在全国人民深切哀悼之时，网民“泰迪”在朋友圈发表侮辱袁隆平言论。警方接报后，将38岁男子熊某查获。目前熊某已被刑拘，案件正在进一步调查中。#定小检播报#O网页链接2菏泽  ,0,0,1,0,山东省菏泽市定陶区人民检察院官方微博,
合肥房天下,05月22日22:19,来自微博weibo.com, #钟南山团队悼念袁隆平院士#【钟南山曾劝袁隆平戒烟】5月22日，钟南山院士创新研究团队发文“国士无双”悼念袁隆平院士。早在2011年，钟南山在某颁奖盛典上为袁隆平颁奖时曾劝其戒烟。,0,1,0,5,北京搜房网络技术有限公司合肥分公司 官方微博,合肥房天下买房、卖房官方平台，为您提供行业动态和优惠讯息。每日推送新鲜房产资讯、购房指南、优质房源、看房秘籍，为您开启一站式购房服务！房天下，Fang.com！
四川公安,05月22日22:32,来自iPhone客户端, “杂交水稻之父”、中国工程院院士、“共和国勋章”获得者袁隆平，5月22日13点07分在湖南长沙逝世，享年91岁。袁隆平是我国研究与发展杂交水稻的开创者，也是世界上第一个成功利用水稻杂种优势的科学家，被誉为“杂交水稻之父”。“仓廪实而知礼节，衣食足而知荣辱。”送别先生。🙏🙏​,0,13,6,33,四川省公安厅官方微博,关注政务时，官方信息很重要。众说纷纭时，事实真相很重要。释疑解惑时，真诚态度很重要。让诉求与回应完美互动，便是四川公安政务微博力求的姿态。温馨提示：危险时刻，请拨打110！
宁波教育,05月24日14:55,来自微博视频号, 造福世界的技术、攻坚克难的勇气、乐观豁达的心态、低调谦逊的美德、还有他未竟的梦想……“风吹过稻田我就想起你”“以后，我们帮您把种子撒向更远方”……#91秒追忆袁隆平#↓↓#袁隆平院士遗体送别#仪式将于今天举行。（人民日报）L人民日报的微博视频​,0,0,0,1,宁波市教育局官方微博、教育官微联盟成员,书藏古今，港通天下。我们在浙江宁波等你~
哈尔滨检察,05月24日10:49,来自微博视频号, 【南京为您而亮！#南京地标亮灯缅怀袁隆平#】5月23日晚，南京新街口、鼓楼、湖南路、夫子庙等地大屏上都播出了缅怀袁隆平院士的视频。袁隆平院士曾就读于南京师范大学附属中学，2002年，他曾回到母校参加百年校庆。袁隆平院士遗体送别仪式今天举行，#送别袁老#，一路走好！L直播南京官方版的微博视频​​​,0,0,3,0,哈尔滨市人民检察院官方微博,强化法律监督 维护公平正义
温江发布,05月24日11:57,来自小布的Android, 【送别！袁爷爷！】24日上午，#袁隆平院士遗体送别仪式#在长沙举行。一稻济世，万家粮足。今天，我们一起送别袁老，一路走好！#袁隆平遗体送别仪式#L人民网的微博视频​​​,0,1,1,3,成都市温江区互联网信息办公室官方微博,权威发布，政策解读，民生热点，区域动态。关注温江发布，关心温江大事。这里是成都市温江区互联网信息办公室官方微博，感谢您的关注！
山西法制报社,05月24日15:22,来自搜狗高速浏览器, 【天天学习丨总书记为何要求向袁隆平学习？】O天天学习丨总书记为何要求向袁隆平学习？​,0,0,0,0,山西法制报,1984年4月3日创刊，现为对开四版周五刊。 电话：03512776987 网址：http://www.sxfzb.com
创业天府,05月26日08:07,来自微博视频号, #小创关注#这是一部以袁隆平爷爷Q版形象为主角的科普动画片非常值得一看！向所有科研工作者致敬！！L当时我就震惊了的微博视频​,0,0,0,1,成都天府新区科技创新服务中心官方微博,
中宏网新闻,05月24日15:49,来自微博视频号, 【#袁隆平遗体送别仪式#动容一幕：民众悲怆跪地痛哭，袁老安详躺在花海间】5月24日，袁隆平遗体送别仪式在湖南省长沙市明阳山殡仪馆举行。袁老身上盖着鲜红的国旗，周围簇满了花朵，不少民众赶来送袁老最后一程，情绪失控跪地痛哭。袁老，一路走好。L中宏网新闻的微博视频​,0,2,1,25,中宏网官方微博,
平安织里,05月23日21:28,来自iPhone客户端, //@平安湖州:【#袁隆平曾梦见自己在稻穗下乘凉#】//@浙江公安:【#袁隆平曾梦见自己在稻穗下乘凉#】,0,0,0,0,浙江湖州吴兴区公安分局织里派出所,搭建警民连心桥，促进社会大和谐。让民意领航警务，让警务保障民生。治安防范个个参与，和谐社会人人受益。
百姓关注,05月24日10:54,来自微博视频号, 【#袁隆平遗体送别仪式#雨中送别：“袁老，今后我一定好好吃饭”】5月23日一大早，湖南长沙依旧飘着小雨，明阳山下，冒雨自发前来的上万民众手持献花，排着两三公里的长队为袁老送别。其中不少人是学生模样，也有年轻的家长带着孩子，还有腿脚不便的残疾人，身着黑衣或者白衣，手持黄花，神情肃穆。在明阳山殡仪馆门口的祭台前，前来悼念的人们自觉地在雨中排队向前挪动，只为在袁老的遗像前鞠个躬，叩个头，敬上一束鲜花。珍惜粮食，“今后我一定好好吃饭。”或许就是我们对袁老最好的祭奠。#百姓关注记者夜赴长沙送袁老#L百姓关注的微博视频  ,0,0,0,4,,
临沂临港发布,05月22日11:51,来自微博视频号, #袁隆平#【看哭了！#袁隆平宋应星跨越300多年的握手#】古有宋应星“贵五谷而贱金玉”，写就《天工开物》；今有袁隆平心怀“禾下乘凉梦”，致力杂交水稻的研究。尽管相隔300多年，他们却都透过一粒种子找到了造福人民的共同梦想。《典籍里的中国》两位科学家跨越时空的“握手”令人动容！致敬！L人民日报的微博视频  ,0,1,2,2,山东省临沂临港经济开发区宣传办公室官方微博,临沂临港经济开发区欢迎您！
河南共青团,05月27日16:13,来自微博视频号," 【#中国人能自由吃瓜离不开这位奶奶#】中国人能自由吃瓜，离不开吴明珠奶奶数十年的研究和奉献。她是袁隆平的同学，两人分别影响了中国的瓜田和稻田。在她50多年的研究中，培育出28个经国家审定的优质瓜种，有耳熟能详的红心脆、香梨黄、小青皮、黑眉毛、香妃蜜瓜、皇后蜜瓜、郁金香甜瓜、金凤凰、绿宝石瓜、麒麟瓜，还有西瓜中的“王牌”—8424西瓜。她总挂在嘴边的话是:“我的人生就是想结几个瓜，把瓜的甘甜献给人民。""L河南共青团的微博视频  ",0,3,2,34,共青团河南省委官方微博 ,坚定理想信念   心系广大青年                                                                                                                                                                    提高工作能力   锤炼优良作风
中国好网民,05月28日11:00,来自微博视频号, #好网民礼赞建党百年#【致敬！#袁隆平说中国人的饭碗要牢牢端在自己手中#】一粒种子、一棵秧苗，化作万亩良田，战胜了饥饿和恐惧。袁隆平，这位“把论文写在祖国大地上”的老人，一代科学巨擘，为全人类留下了丰富的精神遗产，激励着一代代科研工作者用心坚守，继续拼搏。L央视频的微博视频​,0,4,0,2,“中国好网民”系列活动官方微博,争做中国好网民工程官方微博
唐山检察,05月27日13:28,来自iPhone客户端, 【#中国人能自由吃瓜离不开这位奶奶#：“我的人生就是想结几个瓜”】中国人能自由吃瓜，离不开吴明珠奶奶数十年的研究和奉献。她是袁隆平的同学，两人分别影响了中国的瓜田和稻田。在她50多年的研究中，培育出28个经国家审定的优质瓜种，有耳熟能详的红心脆、香梨黄、小青皮、黑眉毛、香妃蜜瓜、皇后蜜瓜、郁金香甜瓜、金凤凰、绿宝石瓜、麒麟瓜，还有西瓜中的“王牌”—8424西瓜。她总挂在嘴边的话是：“我的人生就是想结几个瓜，把瓜的甘甜献给人民。”L青春山东的微博视频  ,0,9,7,5,河北省唐山市人民检察院官方微博,
芙蓉公安,05月23日07:35,来自nova5i2400万AI四摄, 【#男子侮辱袁老被采取刑事强制措施#】天津公安机关对一名针对袁隆平院士逝世在网上发表侮辱性言论的男子采取刑事强制措施。英雄不容亵渎！​​​​@平安天津​​​,0,0,1,4,湖南省长沙市公安局芙蓉分局官方微博,长沙市公安局芙蓉分局
微博兰州,05月24日11:36,来自微博视频号, 【送别！】今天，#袁隆平遗体送别仪式#。袁老，一路走好。L央视新闻的微博视频​,0,0,0,1,甘肃省兰州互联网新闻中心官方微博,
青春昌都,05月24日16:15,来自微博视频号, 【最后的道别！#夫人泪别袁隆平#】5月24日上午，袁隆平告别仪式现场：遗体上国旗覆盖，安卧鲜花翠柏，夫人神形悲戚，泪别袁老。再回看袁老90岁生日时，将第一口蛋糕喂给老伴，令人心碎。L华商网的微博视频​,0,2,0,2,中国共产主义青年团昌都市委员会官方微博,官方网址：http://tibet.gqt.org.cn/cd/ ； 官方微博：http://weibo.com/chdgqt
新浪广西,05月24日08:38,, #广西稻念袁隆平#【永远怀念！#中国有位袁隆平#】禾下乘凉梦，仓满无饥恐。他用毕生心血，浇灌稻田飘香。今天，发条微博，再送袁老一程！粒粒皆辛苦，后辈不敢忘！#袁隆平遗体送别仪式# #送别袁老#（央视新闻）​,0,10,1,48,新浪广西官方微博，新浪看点广西站官方微博,一览微八桂，共享微生活。为您提供权威、主流、丰富的广西新闻、生活资讯和行业讯息。http://gx.sina.com.cn/
浮梁发布,05月24日13:16,来自iPhone客户端, #袁隆平家乡亮灯致敬#【#九江胜利碑亮灯致敬袁老#】5月23日晚，江西九江市标志性建筑胜利碑亮灯致敬袁隆平院士。夜空中，胜利碑外立面上滚动播放着“禾下乘凉，国之栋梁。江山思国士，丹心映稻田。致敬！缅怀！袁老一路走好！”等内容，寄托着家乡人民对袁隆平院士的无限敬仰和深切怀念。L新华网的微博视频  ,0,0,0,0,浮梁县融媒体中心,浮梁古为望县，自古以瓷茶文化闻名于世，被誉为“世界瓷都之源，中国名茶之乡”。诗人白居易曾写下“商人重利轻别离，前月浮梁买茶去”的诗句。
