发布者ID,发布时间,发布来源,发布内容,收藏数,转发数,评论数,点赞数,verified_reason,description
庐阳公安,05月22日16:31,来自小米11, 【#袁隆平院士逝世#】“杂交水稻之父”、中国工程院院士、“共和国勋章”获得者袁隆平，5月22日13点07分在湖南长沙逝世，享年91岁。袁老，走好！​​​（来源：人民日报）​​​,0,0,0,2,合肥市公安局庐阳分局官方微博,遇到紧急情况请及时拨打110，后台私信警察蜀黍不一定能及时看到的！短信报警请发信息至12110。微信公众号请关注“庐阳公安”。
海拔资讯,05月24日18:27,来自微博视频号, 【全球连线｜袁隆平，整个世界都会记住您！】“杂交水稻之父”、中国工程院院士、“共和国勋章”获得者袁隆平，5月22日13点07分在湖南长沙逝世，享年91岁。来自世界各国的学者、官员纷纷表达他们的哀悼和怀念。O全球连线｜袁隆平，整个世界都会记住您！L海拔资讯的微博视频​,0,0,0,0,国际旅游岛商报社《海拔资讯APP》官方微博,
南开发布,05月25日08:15,来自微博weibo.com, 【天塔连续点亮塔身送别共和国两位院士】#津云镜头#5月24日晚8点-10点，绵绵细雨中，天塔再次点亮塔身，通过在天塔塔身上呈现9幅带有吴孟超院士肖像的画面，缅怀“中国肝胆外科之父”。5月22日，共和国一天痛失两位院士，为了缅怀和纪念两位院士对国家作出的杰出贡献，天塔在5月22日-24日，连续举行点亮天塔专题纪念灯光秀活动，送别袁隆平、吴孟超两位院士。活动过程中，众多市民自发到活动现场或者在活动直播页留言，表达哀思。O网页链接  ,0,0,0,0,天津市南开区政府官方微博,
河西数港,05月22日21:46,来自微博weibo.com, 追忆袁隆平与天津小站稻情缘：“一见水稻就来精神儿”O网页链接​,0,0,0,0,天津市河西区大数据管理中心,
优酷,05月22日21:55,来自微博视频号, #袁隆平逝世#珍贵视频曝光！袁隆平生前采访，最后的心愿“明年我们再发展一下好不好”>>L优酷纪录片的优酷视频​,0,224,200,1649,优酷官方微博,
陕西铁检,05月24日11:28,来自iPhone客户端, #袁老身上覆盖着鲜红的国旗#【#袁隆平遗体送别仪式上民众跪地痛哭#】5月24日上午10时，“杂交水稻之父”、“共和国勋章”获得者袁隆平院士遗体送别仪式在长沙市明阳山殡仪馆铭德厅举行。社会各界人士送别袁隆平院士最后一程。（中新视频）L中新视频的微博视频​​​​,0,3,4,8,陕西省人民检察院西安铁路运输分院官方微博,
贵阳交通广播,05月22日20:33,来自HUAWEIMate10Pro, 【#联合国悼念袁隆平#：国士无双，一路走好】今天，袁隆平院士在湖南长沙逝世。@联合国发文悼念：“袁隆平院士为推进粮食安全、消除贫困、造福民生做出了杰出贡献！#国士无双#，一路走好！”​​​（via人民日报）2贵阳​,0,0,0,0,贵阳交通广播官方微博,贵州首家专业交通广播。与贵阳交警联合创办，独家在贵阳交警指挥大厅设立直播间，信息全面、准确，及时。
沈铁锦州站,05月28日17:32,来自微博weibo.com, 【#重听袁隆平这句话泪流满面#】,0,0,0,0,中国铁路沈阳局集团有限公司锦州站,
法制网,05月23日20:51,来自iPhone客户端, 【#袁隆平曾在电影中出演自己#用英语阐述两大梦想说起梦境幸福微笑中国工程院院士、“共和国勋章”获得者袁隆平2021年5月22日13点07分在湖南长沙逝世，享年91岁。在电影《袁隆平》结尾，袁隆平曾亲自出演老年的自己，对外国记者用英语风趣幽默地阐释了自己的两大梦想——“禾下乘凉梦”和“杂交水稻覆盖全球梦”。送别袁老！via.海外网#袁隆平曾在电影中出演自己用英语阐述梦想#L环球网的微博视频  ,0,17,2,33,法治日报官方网站法制网官方微博,中国法治类媒体龙头《法治日报》旗下的中央新闻网站。
忠县法院,05月22日21:14,来自Android, 【痛悼！#送别国之脊梁袁隆平#】今天，#共和国痛失袁隆平院士#。“我最大的愿望是饭碗要牢牢地掌握在我们中国人自己手上！”他把一生浸在稻田里，把功勋写在大地上。国士无双，致敬，缅怀！#袁隆平逝世#L央视新闻的微博视频​​​​,0,0,0,2,重庆市忠县人民法院官方微博,
南京晨报,05月22日18:46,来自微博视频号, 【雨中泪别袁隆平院士：#灵车载着袁老再看一眼曾工作的地方#】22日下午4时10分许，袁隆平院士的遗体从中南大学湘雅医院起灵，前往长沙明阳山殡仪馆，中途灵车在袁院士长期生活工作的湖南杂交水稻研究中心绕行一周，希望让袁院士再看一眼自己生命所系的事业和他最亲爱的同事和学生。记者在现场看到，大批同事、学生早已在此等候，泪别袁隆平院士。#这颗星永远不会陨落#（记者刘芳洲陈思汗）by新华社L新华社的微博视频  ,0,3,1,1,南京晨报官方微博,走进新阅读时代，品牌铸就平台
正观视频,05月25日17:51,来自微博视频号, #长沙花店被曝欺骗买花吊唁网友#【#涉事花店否认欺骗买花吊唁网友#：这几天太忙，没时间逐一拍图】多名网友反映，最近通过外卖平台上的一些长沙花店，购买鲜花祭奠袁隆平爷爷，却发现店家将同一束花换上不同卡片，在店内拍照即返图，并未送至祭奠现场，质疑遭到商家欺骗。@中国新闻周刊联系到其中一家涉事花店，花店工作人员回复，近日由于太忙没时间逐一拍照，但都是按照订单排号，一车一车送过去，“配送师傅进去都要排一个小时，没有时间一一拍图，只能拍个全景的，仔细看的话每个卡片都是不一样的。”该店家表示自家花店已经开了十多年，不会做这样的事。#周刊君调查#发现，该花店收录在外卖平台已7年，共169条评价，低分评价13条。#长沙花店被曝欺骗买花吊唁网友#L中国新闻周刊的微博视频  ,0,0,3,7,正观视频官方微博,正观视频官方微博账号。报料邮箱：zhengguanvideo@163.com
平安商丘,05月22日13:58,来自微博weibo.com, 痛悼！#共和国痛失袁隆平院士#,0,2,4,10,商丘市公安局官方微博 ,发布警方权威信息，提供全方位便民服务，开启警民指尖上的对话，尽在@平安商丘 官方微博。（官方微信公众平台：商丘公安微发布）
中国网,05月23日08:33,来自微博视频号, #殡仪馆不接待群众悼念袁隆平#【根据#袁隆平丧事从简#遗愿，殡仪馆不安排接待群众悼念】记者今天晚上从袁隆平院士家属处获悉，根据袁隆平院士丧事从简的遗愿和当前疫情防控形势，明天长沙明阳山殡仪馆不安排接待群众前来悼念。“非常感谢大家对袁隆平院士的哀悼和对家属的慰问。”袁隆平院士家属说。@湖南日报L湖南日报的微博视频  ,0,102,4,130,中国网官方微博,中国网是用10个语种11个文版发布信息，向世界介绍中国的中央重点新闻网站，是中国进行国际传播、信息交流的重要窗口。
上海长宁消防,05月22日15:19,来自HUAWEIP40Pro+5G, #袁隆平逝世#“杂交水稻之父”、中国工程院院士、“共和国勋章”获得者袁隆平，5月22日13点07分在湖南长沙逝世，享年91岁。袁隆平院士生前关心公益，积极为消防安全发声，让我们一起缅怀他#我毕生追求就是让所有人远离饥饿# #科普消防说#​​​,0,0,0,1,上海市长宁区消防救援支队官方微博,守护一方平安
新浪无锡,05月25日09:09,来自微博weibo.com, 【警情通报#无锡一网民侮辱袁隆平被刑拘#】2021年5月22日，袁隆平逝世。无锡警方接到举报，网民“顺顺”在朋友圈公开发表侮辱、诋毁性言论，造成恶劣社会影响。经工作，警方于23日晚将该网民高某顺（男，39岁）抓获。目前，高某顺已被公安机关依法刑事拘留，案件正在进一步办理中。英雄烈士不容亵渎，网络空间不是法外之地。对于公然侮辱英雄烈士的行为，公安机关将依法严厉查处。（来源：锡山警方）  ,0,15,71,167,新浪无锡官方微博,新浪无锡官方微博。观无锡知天下。
山东辟谣,06月09日16:07,来自微博weibo.com, #山东辟谣# #微博辟谣#【2人涉嫌侵害袁隆平院士名誉，立案调查！】近日，福建省@厦门检察依法对侵害袁隆平院士名誉、侵害社会公共利益，涉嫌侵害英雄烈士名誉罪的两起案件当事人进行民事#公益诉讼#立案调查。5月22日，袁隆平院士逝世。网民王某雄在其微博账户发布数条侮辱包括袁隆平院士在内的四位知名人士的微博，造成不良影响。网民杨某兵在其微信朋友圈发表、转发多条对袁隆平院士具有侮辱性的言论及文章链接，歪曲、诋毁袁隆平院士的形象。厦门市人民检察院依法决定分别对王某雄、杨某兵侵害袁隆平院士名誉、侵害社会公共利益的行为进行民事公益诉讼立案调查。@中国互联网联合辟谣平台  ,0,1,0,2,山东省互联网违法和不良信息举报中心官方微博,打击网络谣言，净化网络环境
齐鲁晚报,06月04日19:25,来自微博视频号, 【#官方回应长沙花店欺骗买花吊唁网友#：存在违法事实，已吊销执照】湖南长沙。袁隆平院士去世，不少网友在某花店买花吊唁却被用一张图欺骗。6月4日，开福区市场监督管理局回应，该花店在5月24日前后共接到约400个订单，存在配送欺诈违法事实，事后补送了3万多元鲜花，目前花店已吊销执照。该工作人员称调查还在继续，同时向网友们致歉，希望大家相信长沙。L沸点视频的微博视频via.@沸点视频  ,0,12,57,595,齐鲁晚报官方微博,办主流大报，树百年品牌，齐鲁晚报是山东省发行量和社会影响力最大的都市报。目前齐鲁晚报构建的“一报两微一端一网”融媒矩阵，全媒覆盖人群超过1000万。2016年，齐鲁晚报荣膺“全国晚报二十强”并排名第二，同时入选亚洲品牌500强。线索爆料与媒体合作请发送至qlwb2011@sina.com。
内蒙古广播电视台,06月22日15:14,来自搜狗高速浏览器, 【袁隆平儿子接棒！】近日，袁隆平儿子、国家杂交水稻工程技术研究中心副主任袁定阳北上内蒙古，继续“袁梦计划”。O袁隆平儿子接棒！​,0,0,0,0,内蒙古人民广播电台官方微博,
南阳政法,06月19日17:02,来自微博视频号, #我承诺不浪费粮食#【重温，泪流满面#袁隆平讲禾下乘凉梦的珍贵影像#】“我梦见水稻长得比高粱还高，穗子比扫帚还长，我和同事坐在稻穗下乘凉”“我梦见穗子沉甸甸的，子粒接近花生米那么大”……这是袁老做过的两个幸福的梦。他的愿望非常朴实：“想培育出高产量品种，为提高粮食产量做一点贡献”↓↓缅怀！致敬！#专题片敢教日月换新天#L南阳政法的微博视频  ,0,1,2,4,中共南阳市委政法委员会官方微博,中共南阳市委政法委员会官方微博
南阳消防,05月30日09:40,来自OPPOR15x, 【他们，才是#中国人最该追的星#！致敬！】“憋着一肚子气”搞导弹研发的钱学森、“要求自己鞠躬尽瘁”的中国第一代核潜艇总师黄旭华、为杂交水稻奉献一生的袁隆平……他们在不同领域呕心沥血，无愧为国之脊梁！今天，全国科技工作者日。发条微博，#致敬科技工作者#！​​​,0,0,0,0,河南省南阳市消防救援支队官方微博,
江苏省妇联,06月21日17:24,来自iPhone客户端, 【#袁隆平儿子接棒继续袁梦计划】距离袁隆平院士逝世将近一个月，袁隆平儿子、国家杂交水稻工程技术研究中心副主任袁定阳已继承衣钵，北上内蒙古，继续“袁梦计划”。袁定阳表示，力争3年内实现兴安盟水稻每亩增产100公斤；培育兴安盟自主知识产权的水稻新品种；实现兴安盟耐盐碱水稻种植面积3年达到20万亩。2020年1月13日，袁隆平在三亚发布“袁梦计划”，在盐碱地上种水稻。（光明日报）L人民网的微博视频  ,0,0,0,0,江苏省妇女联合会官方微博,江苏省妇女联合会官方微信已正式上线啦！您可以搜索微信号“jssfnlhh”，关注我们！
石家庄文旅之声,06月21日16:40,来自微博视频号, 【#袁隆平儿子接棒继续袁梦计划#】距离袁隆平院士逝世将近一个月，袁隆平儿子、国家杂交水稻工程技术研究中心副主任袁定阳已继承衣钵，北上内蒙古，继续“袁梦计划”。袁定阳表示，力争3年内实现兴安盟水稻每亩增产100公斤；培育兴安盟自主知识产权的水稻新品种；实现兴安盟耐盐碱水稻种植面积3年达到20万亩。2020年1月13日，袁隆平在三亚发布“袁梦计划”，在盐碱地上种水稻。（光明日报）O袁隆平儿子接棒！L人民网的微博视频  ,0,0,3,4,石家庄市文化广电和旅游局官方微博,石家庄市文化广电和旅游局，期待您的关注！
南昌日报,06月19日10:20,来自微博视频号, 【重温，泪流满面#袁隆平讲禾下乘凉梦的珍贵影像#】“我梦见水稻长得比高粱还高，穗子比扫帚还长，我和同事坐在稻穗下乘凉”“我梦见穗子沉甸甸的，子粒接近花生米那么大”……这是袁老做过的两个幸福的梦。他的愿望非常朴实：“想培育出高产量品种，为提高粮食产量做一点贡献”↓↓缅怀！致敬！#专题片敢教日月换新天#（央视新闻）L央视新闻的微博视频  ,0,0,0,0,南昌日报,在这里，读懂“英雄城”。
上海崇明,05月30日10:59,来自iPhone客户端, #袁花花经常陪袁隆平听报告#袁隆平院士用小提琴演奏《我的祖国》，看着看着泪目了！祖国和人民都不会忘记您！怀念袁老！L环球纪录频道的微博视频​​​,0,0,0,0,上海市崇明区人民政府新闻办公室官方微博,传递权威崇明信息，传播权威崇明资讯、讲述动人崇明故事、传播美丽崇明形象，倾听来自您的声音......
城关区检察院,06月20日21:27,来自iPhone客户端, 【重温，泪流满面#袁隆平讲禾下乘凉梦的珍贵影像#】“我梦见水稻长得比高粱还高，穗子比扫帚还长，我和同事坐在稻穗下乘凉”“我梦见穗子沉甸甸的，子粒接近花生米那么大”……这是袁老做过的两个幸福的梦。他的愿望非常朴实：“想培育出高产量品种，为提高粮食产量做一点贡献”↓↓缅怀！致敬！L央视新闻的微博视频  ,0,0,0,0,兰州市城关区人民检察院,检察官，只为公正而起立！
黄山反邪教,06月03日08:20,来自微博weibo.com, 【纪录片回顾#袁隆平事迹入选高中语文教材#】,0,0,0,0,安徽省黄山市人民政府防范和处理邪教问题办公室官方微博,反邪教宣传工作人员，传播正能量的使者。
新浪河北,06月19日12:33,来自iPhone客户端, 【重温，泪流满面#袁隆平讲禾下乘凉梦的珍贵影像#】“我梦见水稻长得比高粱还高，穗子比扫帚还长，我和同事坐在稻穗下乘凉”“我梦见穗子沉甸甸的，子粒接近花生米那么大”……这是袁老做过的两个幸福的梦。他的愿望非常朴实：“想培育出高产量品种，为提高粮食产量做一点贡献”↓↓缅怀！致敬！#专题片敢教日月换新天#L央视新闻的微博视频  ,0,0,0,3,新浪河北官方微博，新浪看点河北站官方微博,最全面、最快速的河北新闻资讯发布平台，网罗河北事，尽在新浪河北！http://hebei.sina.com.cn/
青羊共青团,06月03日10:39,来自微博视频号, #青春课堂#【袁隆平事迹入选语文教材】统编高中语文教材中，编进了《喜看稻菽千重浪——记首届国家最高科技奖获得者袁隆平》一文，深度讲述了“杂交水稻之父”袁隆平科研背后的故事。脚下浸泥土，心中怀大爱，国之仁士为国为民的情怀，刻入学生心田，世世代代相传。L央视国家记忆的微博视频​,0,2,1,6,共青团成都市青羊区委员会官方微博,
网信呼和浩特,06月21日18:01,来自微博视频号, 【#袁隆平儿子接棒继续袁梦计划#】距离袁隆平院士逝世将近一个月，袁隆平儿子、国家杂交水稻工程技术研究中心副主任袁定阳已继承衣钵，北上内蒙古，继续“袁梦计划”。袁定阳表示，力争3年内实现兴安盟水稻每亩增产100公斤；培育兴安盟自主知识产权的水稻新品种；实现兴安盟耐盐碱水稻种植面积3年达到20万亩。2020年1月13日，袁隆平在三亚发布“袁梦计划”，在盐碱地上种水稻。（光明日报）L人民网的微博视频  ,0,0,0,1,中共呼和浩特市委员会网络安全和信息化委员会办公室,“呼和浩特”蒙古语意为“青色的城”，是内蒙古自治区首府，是自治区政治、经济、文化、科技和金融中心。呼和浩特有着深厚悠久的历史文化和丰富多元的民族地域特色。进入新时代，呼和浩特先后获得“国家森林城市”、“中国历史文化名城”、“中国乳都”、“中国优秀旅游城市”、“中国经济最具活力十城之一”、“中国特色魅力城市200强”、“中国投资环境50优城市”、“中国综合实力百强城市”、“中国十大节庆城市”等荣誉。
平安江阳,06月21日19:44,来自微博视频号, 【以传承印证初心！#袁隆平儿子接棒#】#平安法治2021#距离袁隆平院士逝世将近一个月，国家杂交水稻工程技术研究中心副主任袁定阳将继承父亲衣钵，北上内蒙古，逐步实现袁隆平院士生前规划的“袁梦计划”。力争3年内实现兴安盟水稻每亩增产100公斤；培育兴安盟自主知识产权的水稻新品种；实现兴安盟耐盐碱水稻种植面积3年达到20万亩。L人民网的微博视频  ,0,12,8,9,四川省泸州市公安局江阳区分局官方微博,用真诚，让您感受“指尖上的温度”！
左江日报,06月02日22:01,来自iPhone客户端, #袁隆平事迹入选语文教材#【纪录片回顾#袁隆平事迹入选高中语文教材#】他怀着“禾下乘凉梦”，半个世纪致力于水稻研究。在统编高中语文教材中，编进了《喜看稻菽千重浪——记首届国家最高科技奖获得者袁隆平》一文，讲述了“杂交水稻之父”袁隆平科研背后的故事。脚下浸泥土，心中怀大爱。国之仁士、为国为民，致敬！（来源：央视国家记忆）L央视国家记忆的微博视频2崇左  ,0,0,0,0,左江日报官方微博,
平安诸暨,06月19日09:45,来自iPhone客户端, 【重温，泪流满面#袁隆平讲禾下乘凉梦的珍贵影像#】“我梦见水稻长得比高粱还高，穗子比扫帚还长，我和同事坐在稻穗下乘凉”“我梦见穗子沉甸甸的，子粒接近花生米那么大”……这是袁老做过的两个幸福的梦。他的愿望非常朴实：“想培育出高产量品种，为提高粮食产量做一点贡献”↓↓缅怀！致敬！L央视新闻的微博视频  ,0,0,1,2,浙江绍兴市诸暨市公安局官方微博,更多信息请微信关注【诸暨警方】
当涂教育,06月02日17:25,来自360安全浏览器, 【当涂经贸学校举办“育新人、凝匠心、传技艺”讲座】为弘扬劳模精神、劳动精神、工匠精神，培养学生“专业、专心、传承、创新、责任、担当”的优秀品质，培育优秀技能人才，5月26日下午，当涂经贸学校举办了一场主题为“育新人、凝匠心、传技艺”的精彩讲座。本次讲座在教务处主任汤君振奋人心的开场词中拉开序幕。随后，讲座的主讲人刘自波老师以“杂交水稻之父”袁隆平的事迹为例，向同学们介绍了袁隆平院士的功勋事迹，号召同学们学习袁院士身上体现的大国工匠精神。座下学生无不感动，纷纷表示要向袁隆平院士学习，认认真真学专业，踏踏实实练技能。此外，刘老师还分享了数控专业的专业特点以及发展历程、创新成果，同时分享了自己的成长经历。他勉励同学们只要怀有匠心、坚持学习、接受磨炼，不管到哪里，不管做什么事情，都将会成功。他希望同学们今后能够扎根专业，不断探索，精益求精，把自己铸就成为一名优秀工匠，为建设家乡贡献力量！  ,0,0,0,1,安徽省当涂县教育局官方微博,
临汾政法,06月21日17:39,来自微博weibo.com, 【#袁隆平儿子接棒继续袁梦计划#】,0,0,0,1,中共临汾市委政法委员会官方微博,临汾市委政法委官方微博
益阳检察,06月03日15:05,来自微博视频号, 【纪录片回顾#袁隆平事迹入选高中语文教材#】他怀着“禾下乘凉梦”，半个世纪致力于水稻研究。在统编高中语文教材中，编进了《喜看稻菽千重浪——记首届国家最高科技奖获得者袁隆平》一文，讲述了“杂交水稻之父”袁隆平科研背后的故事。脚下浸泥土，心中怀大爱。国之仁士、为国为民，致敬！L央视国家记忆的微博视频  ,0,0,0,0,湖南省益阳市人民检察院官方微博,
菏泽日报,06月21日18:02,来自iPhone客户端, 【#袁隆平儿子接棒继续袁梦计划#】距离袁隆平院士逝世将近一个月，袁隆平儿子、国家杂交水稻工程技术研究中心副主任袁定阳已继承衣钵，北上内蒙古，继续“袁梦计划”。袁定阳表示，力争3年内实现兴安盟水稻每亩增产100公斤；培育兴安盟自主知识产权的水稻新品种；实现兴安盟耐盐碱水稻种植面积3年达到20万亩。2020年1月13日，袁隆平在三亚发布“袁梦计划”，在盐碱地上种水稻。（光明日报）O袁隆平儿子接棒！L人民网的微博视频  ,0,0,0,0,《菏泽日报》,
双流服务,06月19日12:48,来自微博视频号, 【重温，泪流满面#袁隆平讲禾下乘凉梦的珍贵影像#】“我梦见水稻长得比高粱还高，穗子比扫帚还长，我和同事坐在稻穗下乘凉”“我梦见穗子沉甸甸的，子粒接近花生米那么大”……这是袁老做过的两个幸福的梦。他的愿望非常朴实：“想培育出高产量品种，为提高粮食产量做一点贡献”↓↓缅怀！致敬！L央视新闻的微博视频  ,0,0,0,0,成都市双流区行政审批局官方微博,
南铁宜春车务段,05月29日10:47,来自华为Mate40保时捷设计, #宜车微视角#【择一事，尽全心！致敬#衣食住行背后的院士天团#】“杂交水稻之父”#袁隆平#，一生躬耕田间，只为天下稻香年丰；“甜瓜院士”吴明珠，一心扎根新疆，只为岁岁瓜果飘香…网友：衣食住行，方方面面，原来美好生活是因为有科学家在奋斗。“科”之大者，为国为民，转发传递：感谢数十年如一日的钻研↓↓（人民日报）  ,0,0,0,1,中国铁路南昌局集团有限公司宜春车务段官方微博,
北京政法,06月19日22:30,来自微博视频号, #晚安#“我梦见水稻长得比高粱还高，穗子比扫帚还长，我和同事坐在稻穗下乘凉”“我梦见穗子沉甸甸的，子粒接近花生米那么大”……这是袁老做过的两个幸福的梦。他的愿望非常朴实：“想培育出高产量品种，为提高粮食产量做一点贡献”↓↓缅怀！致敬！L央视新闻的微博视频#袁隆平讲禾下乘凉梦的珍贵影像#@央视新闻  ,0,2,4,8,北京政法网官方微博,助力平安北京 服务首都百姓
苏州政法,06月02日22:04,来自微博视频号, 【纪录片回顾#袁隆平事迹入选高中语文教材#】他怀着“禾下乘凉梦”，半个世纪致力于水稻研究。在统编高中语文教材中，编进了《喜看稻菽千重浪——记首届国家最高科技奖获得者袁隆平》一文，讲述了“杂交水稻之父”袁隆平科研背后的故事。脚下浸泥土，心中怀大爱。国之仁士、为国为民，致敬！L央视国家记忆的微博视频  ,0,1,3,2,中国共产党苏州市委员会政法委员会官方微博,
环球网,05月31日06:44,来自微博视频号, 【#袁花花经常陪袁隆平听报告#：试验田里逮过青蛙，袁老对它十分宠爱】湖南长沙，袁花花是袁隆平院士在2020年五一收养的小猫，袁老对它十分宠爱。杂交水稻研究中心研究员辛业芸称，袁花花经常陪着袁老听工作汇报，曾在试验田里捉过青蛙老鼠。袁老回来时，小猫跑着去迎接，要躺在离袁老最近的地方。@一手VideoL一手Video的微博视频  ,0,69,57,810,环球网微博,环球网【http://www.huanqiu.com】是由《环球时报》社主办的中英文双语网站，每日滚动发送热门国际台海新闻。环球网，世界很精彩！
